{
  "$schema": "https://json-schema.org/draft/2020-12/schema",
  "type": "object",
  "additionalProperties": false,
  "required": [
    "schema",
    "runtime_revision",
    "models",
    "licenses",
    "port",
    "timeout_ms",
    "idle_ms",
    "steps",
    "duration_padding_sec",
    "default_duration_seconds",
    "max_duration_seconds",
    "peak_db",
    "ggml_revision"
  ],
  "properties": {
    "schema": {
      "const": "urban:audio-factory-config@1"
    },
    "runtime_revision": {
      "type": "string",
      "pattern": "^[a-f0-9]{40}$"
    },
    "models": {
      "type": "array",
      "minItems": 5,
      "maxItems": 5,
      "items": {
        "type": "object",
        "additionalProperties": false,
        "required": ["file", "url", "sha256", "bytes"],
        "properties": {
          "file": {
            "type": "string",
            "pattern": "^[a-zA-Z0-9_.-]+\\.gguf$"
          },
          "url": {
            "type": "string",
            "pattern": "^https://huggingface.co/"
          },
          "sha256": {
            "type": "string",
            "pattern": "^[a-f0-9]{64}$"
          },
          "bytes": {
            "type": "integer",
            "minimum": 1
          }
        }
      },
      "prefixItems": [
        {
          "properties": {
            "file": {
              "const": "stable-audio-3-medium-conditioner-v1.0-F32.gguf"
            }
          },
          "type": "object"
        },
        {
          "properties": {
            "file": {
              "const": "stable-audio-3-medium-dit-1.5B-v1.0-F16.gguf"
            }
          },
          "type": "object"
        },
        {
          "properties": {
            "file": {
              "const": "stable-audio-3-medium-same-l-v1.0-F16.gguf"
            }
          },
          "type": "object"
        },
        {
          "properties": {
            "file": {
              "const": "t5gemma-b-b-ul2-encoder-0.3B-v1.0-F32.gguf"
            }
          },
          "type": "object"
        },
        {
          "properties": {
            "file": {
              "const": "t5gemma-b-b-ul2-v1.0-vocab.gguf"
            }
          },
          "type": "object"
        }
      ]
    },
    "licenses": {
      "type": "array",
      "minItems": 2,
      "items": {
        "type": "object",
        "additionalProperties": false,
        "required": ["name", "url"],
        "properties": {
          "name": {
            "type": "string"
          },
          "url": {
            "type": "string",
            "pattern": "^https://"
          }
        }
      }
    },
    "port": {
      "type": "integer",
      "minimum": 1024,
      "maximum": 65535
    },
    "timeout_ms": {
      "type": "integer",
      "minimum": 1
    },
    "idle_ms": {
      "type": "integer",
      "minimum": 1
    },
    "steps": {
      "const": 8
    },
    "duration_padding_sec": {
      "const": 0
    },
    "default_duration_seconds": {
      "type": "number",
      "minimum": 0.5,
      "maximum": 60
    },
    "max_duration_seconds": {
      "type": "number",
      "minimum": 0.5,
      "maximum": 60
    },
    "peak_db": {
      "type": "number",
      "minimum": -20,
      "maximum": -3
    },
    "ggml_revision": {
      "type": "string",
      "pattern": "^[a-f0-9]{40}$"
    }
  }
}
